{
  "schema_version": "2.0",
  "pack_id": "campus-innovation-pitch-v2",
  "name": "Campus Innovation Pitch",
  "source_mode": "registered_composition",
  "deck_family_id": "campus-innovation-pitch",
  "style_cluster_id": "optimistic-technical-stage",
  "certification": "certified",
  "rights": {"decision": "allowed", "basis": "first-party", "evidence": "repository-owned"},
  "materializer": "registered_native_renderer",
  "art_direction": {
    "theme_id": "technology",
    "palette": ["#071A2F", "#00B7A8", "#FFB347", "#EAF7F5", "#FFFFFF"],
    "type_scale": {"display": 46, "title": 30, "body": 18, "label": 12},
    "grid": {"columns": 12, "safe_margin_x_in": 0.5, "safe_margin_y_in": 0.4},
    "spacing_pt": [8, 16, 24, 32, 48, 64],
    "motifs": ["signal-arc", "prototype-grid", "field-line"],
    "forbidden": ["random-gradient", "generic-card-wall", "fake-device-frame", "tiny-label"],
    "max_same_family_run": 2,
    "hero_interval": 4
  },
  "choreography": ["cover", "agenda", "problem", "map", "product", "prototype", "pilot", "business-model", "team", "ask", "closing", "appendix"]
}
